{"iteration":0,"timestamp":"2026-09-18T22:31:14.434Z","kind":"baseline","proposedChangeSummary":"baseline (DecisionTreeClassifier(max_depth=2)), measured fresh at loop start","guardVerdict":"n/a","guardReason":null,"metricBefore":null,"metricAfter":0.6711111111111111,"elapsedSeconds":6.1845596,"baselineElapsedSeconds":6.1845596,"decision":"baseline","reason":"initial measurement, not an edit","bestSoFarAfter":0.6711111111111111}
{"iteration":1,"timestamp":"2026-09-18T22:31:14.444Z","kind":"edit","proposedChangeSummary":"model changed DecisionTreeClassifier -> RandomForestClassifier; 55 -> 51 lines","guardVerdict":"passed","guardReason":null,"metricBefore":0.6711111111111111,"metricAfter":0.88,"elapsedSeconds":8.4504862,"baselineElapsedSeconds":6.1845596,"decision":"kept","reason":"held-out accuracy improved from 0.6711 to 0.8800","bestSoFarAfter":0.88}
{"iteration":2,"timestamp":"2026-09-18T22:34:54.749Z","kind":"edit","proposedChangeSummary":null,"guardVerdict":"rejected","guardReason":"propose step failed: ctx.llm.stream did not finish within 120000ms (after 3 attempts)","metricBefore":0.88,"metricAfter":null,"elapsedSeconds":null,"baselineElapsedSeconds":6.1845596,"decision":"reverted","reason":"propose step failed: ctx.llm.stream did not finish within 120000ms (after 3 attempts)","bestSoFarAfter":0.88}
{"iteration":3,"timestamp":"2026-09-18T22:40:54.789Z","kind":"edit","proposedChangeSummary":"model changed RandomForestClassifier -> HistGradientBoostingClassifier; 51 -> 51 lines","guardVerdict":"passed","guardReason":null,"metricBefore":0.88,"metricAfter":0.8744444444444445,"elapsedSeconds":7.5958719,"baselineElapsedSeconds":6.1845596,"decision":"reverted","reason":"held-out accuracy did not improve (0.8744 did not exceed best 0.8800)","bestSoFarAfter":0.88}
{"iteration":4,"timestamp":"2026-09-18T22:41:35.766Z","kind":"edit","proposedChangeSummary":"model stayed RandomForestClassifier (hyperparameters/features likely changed); 51 -> 51 lines","guardVerdict":"passed","guardReason":null,"metricBefore":0.88,"metricAfter":0.8777777777777778,"elapsedSeconds":7.6337117,"baselineElapsedSeconds":6.1845596,"decision":"reverted","reason":"held-out accuracy did not improve (0.8778 did not exceed best 0.8800)","bestSoFarAfter":0.88}
{"iteration":5,"timestamp":"2026-09-18T22:43:04.981Z","kind":"edit","proposedChangeSummary":"model stayed RandomForestClassifier (hyperparameters/features likely changed); 51 -> 51 lines","guardVerdict":"passed","guardReason":null,"metricBefore":0.88,"metricAfter":0.8777777777777778,"elapsedSeconds":7.6929518,"baselineElapsedSeconds":6.1845596,"decision":"reverted","reason":"held-out accuracy did not improve (0.8778 did not exceed best 0.8800)","bestSoFarAfter":0.88}
{"iteration":6,"timestamp":"2026-09-18T22:47:39.141Z","kind":"edit","proposedChangeSummary":null,"guardVerdict":"rejected","guardReason":"propose step failed: ctx.llm.stream did not finish within 120000ms (after 3 attempts)","metricBefore":0.88,"metricAfter":null,"elapsedSeconds":null,"baselineElapsedSeconds":6.1845596,"decision":"reverted","reason":"propose step failed: ctx.llm.stream did not finish within 120000ms (after 3 attempts)","bestSoFarAfter":0.88}
{"iteration":7,"timestamp":"2026-09-18T22:53:39.195Z","kind":"edit","proposedChangeSummary":"model stayed RandomForestClassifier (hyperparameters/features likely changed); 51 -> 51 lines","guardVerdict":"passed","guardReason":null,"metricBefore":0.88,"metricAfter":0.8777777777777778,"elapsedSeconds":7.6348202,"baselineElapsedSeconds":6.1845596,"decision":"reverted","reason":"held-out accuracy did not improve (0.8778 did not exceed best 0.8800)","bestSoFarAfter":0.88}
{"iteration":8,"timestamp":"2026-09-18T22:56:51.878Z","kind":"edit","proposedChangeSummary":"model changed RandomForestClassifier -> ExtraTreesClassifier; 51 -> 51 lines","guardVerdict":"passed","guardReason":null,"metricBefore":0.88,"metricAfter":0.8866666666666667,"elapsedSeconds":5.5012275,"baselineElapsedSeconds":6.1845596,"decision":"kept","reason":"held-out accuracy improved from 0.8800 to 0.8867","bestSoFarAfter":0.8866666666666667}
{"iteration":9,"timestamp":"2026-09-18T23:02:05.121Z","kind":"edit","proposedChangeSummary":"model stayed ExtraTreesClassifier (hyperparameters/features likely changed); 51 -> 51 lines","guardVerdict":"passed","guardReason":null,"metricBefore":0.8866666666666667,"metricAfter":0.8966666666666666,"elapsedSeconds":7.3907982,"baselineElapsedSeconds":6.1845596,"decision":"kept","reason":"held-out accuracy improved from 0.8867 to 0.8967","bestSoFarAfter":0.8966666666666666}
{"iteration":10,"timestamp":"2026-09-18T23:05:53.641Z","kind":"edit","proposedChangeSummary":"model stayed ExtraTreesClassifier (hyperparameters/features likely changed); 51 -> 51 lines","guardVerdict":"passed","guardReason":null,"metricBefore":0.8966666666666666,"metricAfter":0.8955555555555555,"elapsedSeconds":6.8266032,"baselineElapsedSeconds":6.1845596,"decision":"reverted","reason":"held-out accuracy did not improve (0.8956 did not exceed best 0.8967)","bestSoFarAfter":0.8966666666666666}
